[
  {
    "id": "basic",
    "name": "Basic Loot",
    "description": "Common items found in basic containers",
    "min_items": 1,
    "max_items": 3,
    "entries": [
      {
        "item_id": "brine_vial",
        "weight": 30,
        "min_count": 1,
        "max_count": 2,
        "chance": 0.7
      },
      {
        "item_id": "salt_poultice",
        "weight": 25,
        "min_count": 1,
        "max_count": 1,
        "chance": 0.6
      },
      {
        "item_id": "storm_glass",
        "weight": 15,
        "min_count": 1,
        "max_count": 1,
        "chance": 0.4
      },
      {
        "item_id": "hand_torch",
        "weight": 20,
        "min_count": 1,
        "max_count": 1,
        "chance": 0.5
      },
      {
        "item_id": "glass_pick",
        "weight": 10,
        "min_count": 1,
        "max_count": 1,
        "chance": 0.3
      },
      {
        "item_id": "crystal_fragment",
        "weight": 8,
        "min_count": 1,
        "max_count": 1,
        "chance": 0.3
      },
      {
        "item_id": "quantum_silk",
        "weight": 6,
        "min_count": 1,
        "max_count": 1,
        "chance": 0.2
      }
    ]
  },
  {
    "id": "valuable",
    "name": "Valuable Items",
    "description": "Rare and valuable items found in secured containers",
    "min_items": 2,
    "max_items": 4,
    "entries": [
      {
        "item_id": "saints_tear",
        "weight": 20,
        "min_count": 1,
        "max_count": 1,
        "chance": 0.6
      },
      {
        "item_id": "storm_glass",
        "weight": 30,
        "min_count": 2,
        "max_count": 4,
        "chance": 0.8
      },
      {
        "item_id": "scripture_shard",
        "weight": 25,
        "min_count": 1,
        "max_count": 2,
        "chance": 0.7
      },
      {
        "item_id": "saint_key",
        "weight": 10,
        "min_count": 1,
        "max_count": 1,
        "chance": 0.3
      },
      {
        "item_id": "angle_lens",
        "weight": 15,
        "min_count": 1,
        "max_count": 1,
        "chance": 0.4
      },
      {
        "item_id": "quantum_core",
        "weight": 8,
        "min_count": 1,
        "max_count": 1,
        "chance": 0.3
      },
      {
        "item_id": "void_essence",
        "weight": 6,
        "min_count": 1,
        "max_count": 1,
        "chance": 0.2
      },
      {
        "item_id": "storm_feather",
        "weight": 10,
        "min_count": 1,
        "max_count": 1,
        "chance": 0.4
      }
    ]
  },
  {
    "id": "glass_items",
    "name": "Glass Artifacts",
    "description": "Items related to glass and refraction",
    "min_items": 1,
    "max_items": 2,
    "entries": [
      {
        "item_id": "storm_glass",
        "weight": 40,
        "min_count": 1,
        "max_count": 3,
        "chance": 0.9
      },
      {
        "item_id": "angle_lens",
        "weight": 30,
        "min_count": 1,
        "max_count": 1,
        "chance": 0.6
      },
      {
        "item_id": "scripture_shard",
        "weight": 20,
        "min_count": 1,
        "max_count": 1,
        "chance": 0.5
      },
      {
        "item_id": "glass_pick",
        "weight": 25,
        "min_count": 1,
        "max_count": 1,
        "chance": 0.7
      },
      {
        "item_id": "prism_core",
        "weight": 15,
        "min_count": 1,
        "max_count": 1,
        "chance": 0.4
      },
      {
        "item_id": "light_prism",
        "weight": 12,
        "min_count": 1,
        "max_count": 1,
        "chance": 0.3
      },
      {
        "item_id": "focusing_crystal",
        "weight": 10,
        "min_count": 1,
        "max_count": 1,
        "chance": 0.3
      },
      {
        "item_id": "light_crystal",
        "weight": 18,
        "min_count": 1,
        "max_count": 1,
        "chance": 0.4
      },
      {
        "item_id": "prism_lens",
        "weight": 8,
        "min_count": 1,
        "max_count": 1,
        "chance": 0.2
      }
    ]
  },
  {
    "id": "archive_tech",
    "name": "Archive Technology",
    "description": "Pre-storm technological artifacts",
    "min_items": 1,
    "max_items": 3,
    "entries": [
      {
        "item_id": "saint_key",
        "weight": 35,
        "min_count": 1,
        "max_count": 1,
        "chance": 0.8
      },
      {
        "item_id": "scripture_shard",
        "weight": 30,
        "min_count": 1,
        "max_count": 2,
        "chance": 0.7
      },
      {
        "item_id": "angle_lens",
        "weight": 25,
        "min_count": 1,
        "max_count": 1,
        "chance": 0.6
      },
      {
        "item_id": "storm_glass",
        "weight": 20,
        "min_count": 1,
        "max_count": 2,
        "chance": 0.5
      },
      {
        "item_id": "archive_component",
        "weight": 15,
        "min_count": 1,
        "max_count": 1,
        "chance": 0.4
      },
      {
        "item_id": "quantum_crystal",
        "weight": 12,
        "min_count": 1,
        "max_count": 1,
        "chance": 0.3
      },
      {
        "item_id": "archive_interface",
        "weight": 8,
        "min_count": 1,
        "max_count": 1,
        "chance": 0.2
      }
    ]
  },
  {
    "id": "supplies",
    "name": "Basic Supplies",
    "description": "Essential survival items",
    "min_items": 2,
    "max_items": 5,
    "entries": [
      {
        "item_id": "brine_vial",
        "weight": 35,
        "min_count": 1,
        "max_count": 3,
        "chance": 0.8
      },
      {
        "item_id": "salt_poultice",
        "weight": 30,
        "min_count": 1,
        "max_count": 2,
        "chance": 0.7
      },
      {
        "item_id": "hand_torch",
        "weight": 25,
        "min_count": 1,
        "max_count": 2,
        "chance": 0.6
      },
      {
        "item_id": "glass_pick",
        "weight": 20,
        "min_count": 1,
        "max_count": 1,
        "chance": 0.5
      },
      {
        "item_id": "storm_glass",
        "weight": 15,
        "min_count": 1,
        "max_count": 1,
        "chance": 0.4
      },
      {
        "item_id": "practice_crystal",
        "weight": 10,
        "min_count": 1,
        "max_count": 1,
        "chance": 0.3
      },
      {
        "item_id": "novice_robes",
        "weight": 8,
        "min_count": 1,
        "max_count": 1,
        "chance": 0.2
      }
    ]
  },
  {
    "id": "psychic_items",
    "name": "Psychic Artifacts",
    "description": "Items related to quantum consciousness",
    "min_items": 1,
    "max_items": 2,
    "entries": [
      {
        "item_id": "telepathy_amplifier",
        "weight": 25,
        "min_count": 1,
        "max_count": 1,
        "chance": 0.6
      },
      {
        "item_id": "quantum_focus",
        "weight": 30,
        "min_count": 1,
        "max_count": 1,
        "chance": 0.7
      },
      {
        "item_id": "mind_shield",
        "weight": 20,
        "min_count": 1,
        "max_count": 1,
        "chance": 0.5
      },
      {
        "item_id": "consciousness_crystal",
        "weight": 15,
        "min_count": 1,
        "max_count": 1,
        "chance": 0.4
      },
      {
        "item_id": "psychic_codex",
        "weight": 18,
        "min_count": 1,
        "max_count": 1,
        "chance": 0.4
      },
      {
        "item_id": "probability_dice",
        "weight": 22,
        "min_count": 1,
        "max_count": 1,
        "chance": 0.5
      }
    ]
  },
  {
    "id": "faction_gear",
    "name": "Faction Equipment",
    "description": "Specialized equipment from various factions",
    "min_items": 1,
    "max_items": 3,
    "entries": [
      {
        "item_id": "null_field_generator",
        "weight": 15,
        "min_count": 1,
        "max_count": 1,
        "chance": 0.4
      },
      {
        "item_id": "storm_catalyst",
        "weight": 12,
        "min_count": 1,
        "max_count": 1,
        "chance": 0.3
      },
      {
        "item_id": "memory_crystal",
        "weight": 18,
        "min_count": 1,
        "max_count": 1,
        "chance": 0.5
      },
      {
        "item_id": "balance_guide",
        "weight": 20,
        "min_count": 1,
        "max_count": 1,
        "chance": 0.5
      },
      {
        "item_id": "covenant_manifesto",
        "weight": 10,
        "min_count": 1,
        "max_count": 1,
        "chance": 0.3
      },
      {
        "item_id": "ascension_manual",
        "weight": 8,
        "min_count": 1,
        "max_count": 1,
        "chance": 0.2
      }
    ]
  },
  {
    "id": "cosmic_artifacts",
    "name": "Cosmic Artifacts",
    "description": "Items from the Heliograph Expedition and alien contact",
    "min_items": 1,
    "max_items": 2,
    "entries": [
      {
        "item_id": "quantum_communicator",
        "weight": 10,
        "min_count": 1,
        "max_count": 1,
        "chance": 0.3
      },
      {
        "item_id": "cosmic_beacon",
        "weight": 8,
        "min_count": 1,
        "max_count": 1,
        "chance": 0.2
      },
      {
        "item_id": "vasquez_journal",
        "weight": 15,
        "min_count": 1,
        "max_count": 1,
        "chance": 0.4
      },
      {
        "item_id": "quantum_collective_artifact",
        "weight": 5,
        "min_count": 1,
        "max_count": 1,
        "chance": 0.1
      },
      {
        "item_id": "dimensional_key",
        "weight": 6,
        "min_count": 1,
        "max_count": 1,
        "chance": 0.15
      },
      {
        "item_id": "evolution_catalyst",
        "weight": 7,
        "min_count": 1,
        "max_count": 1,
        "chance": 0.2
      }
    ]
  },
  {
    "id": "void_artifacts",
    "name": "Void Artifacts",
    "description": "Dangerous items corrupted by void energy",
    "min_items": 1,
    "max_items": 2,
    "entries": [
      {
        "item_id": "void_shard",
        "weight": 35,
        "min_count": 1,
        "max_count": 2,
        "chance": 0.7
      },
      {